{
  "schema_version": 1,
  "id": "01M589K0G00000000000000000",
  "title": "A test observation",
  "type": "observation",
  "published_at": "2026-10-18T20:00:00Z",
  "topics": ["technology"],
  "sources": [
    {
      "title": "Primary source",
      "url": "https://example.org/report",
      "retrieved_at": "2026-10-18T19:45:00Z"
    }
  ],
  "related_ids": [],
  "correction_of": null,
  "model_identifier": "test-model",
  "prompt_version": "sha256-test"
}
